{"budget": {"depth": "basic", "max_fetch": 8, "max_searches": 8}, "lang": "id", "mode": "pro", "plan_steps": [{"depends_on": [], "goal": "Kumpulkan angka pasar AI search 2026", "id": "s1"}, {"depends_on": ["s1"], "goal": "Bandingkan klaim antar sumber", "id": "s2"}], "query_standalone": "Ukuran pasar AI search engine 2026 dan pangsa Perplexity", "recency": "30d", "search_queries": ["AI search market size 2026", "Perplexity market share 2026 site:statista.com", "Perplexity 1.5 billion queries May 2026"]}
